"id","appId","title","url","description","icon","genres","genreIds","primaryGenre","primaryGenreId","contentRating","languages","size","requiredOsVersion","released","updated","releaseNotes","version","price","currency","free","developerId","developer","developerUrl","developerWebsite","score","reviews","currentVersionScore","currentVersionReviews","screenshots","ipadScreenshots","appletvScreenshots","supportedDevices"
454638411,"com.facebook.Messenger","Messenger","https://apps.apple.com/ao/app/messenger/id454638411?uo=4","Be together whenever, with our free* all-in-one communication app, complete with unlimited text, voice, video calling and group video chat features.
 PRIVACY SETTINGS
 New privacy settings let you choose who can reach you, and where your messages are delivered.
 CUSTOM REACTIONS
 Lost for words? You can customise your reactions, with lots more emojis to choose from.
 CHAT THEMES
 Choose from fun themes and colours, such as Tie-dye or Love, to make your chats more personal.
 WATCH TOGETHER
 Watch videos, tv programmes and films with your friends over Messenger video chat and Rooms when you can't be together. Capture every moment and reaction in real time.
 FREE* VIDEO CALLS TO STAY CONNECTED
 Keep your friends and family close with unlimited live video chatting. Host group video calls with up to eight people, with high-quality audio, high-definition video and interactive video features such as face filters.
 UNLIMITED FREE* TEXT AND PHONE CALLS
 Skip exchanging phone numbers and simply send a message to your Facebook friends, even if they're across the world. Enjoy high-quality voice and text messaging on mobile, tablet and desktop.
 TURN OFF THE LIGHTS IN DARK MODE
 Give your eyes some rest with a sleek new look that darkens the colours of the chat interface.
 RECORD AND SEND VOICE AND VIDEO MESSAGES
 When text just won't cut it, just hit record and send. Say, sing, show or shout it out loud.
 EXPRESS YOURSELF WITH STICKERS, GIFS AND EMOJIS
 Use custom stickers to show your creative side. You can even add effects and filters to video calls.
 SEND FILES, PHOTOS AND VIDEOS
 There's no limit to the number of files you want to share with your friends.
 PLAN AND MAKE IT HAPPEN
 Make plans to get together with polls and more. Suggest a meeting spot or tell friends where you are by sharing your location with just a few taps.
 SEND AND REQUEST MONEY WITH NO FEES
 Send and receive money securely and quickly – right in the app. Split payments in group chats to share rent, travel and other expenses. Start sending money to friends and family by adding your debit card, PayPal account (fees may apply) or prepaid card. Only available in the US.
 CHAT WITH BUSINESSES
 Easily connect with your favourite businesses to make reservations, get customer support, find deals and more.
 COMPATIBLE ACROSS PLATFORMS
 Chat with friends across an array of devices, such as desktop, Portal and others.
 Privacy Policy: https://www.facebook.com/about/privacy/
 LEARN MORE about Messenger texting and group video chat at: http://messenger.com
 * Data rates apply
 Some Messenger features may not be available in your country or region.","https://is1-ssl.mzstatic.com/image/thumb/Purple211/v4/0e/af/cd/0eafcd87-57e2-a840-3115-22d565415429/AppIcon-0-0-1x_U007emarketing-0-7-0-0-sRGB-85-220.png/512x512bb.jpg","[""Social Networking"",""Productivity""]","[""6005"",""6007""]","Social Networking",6005,"12+","[""HR"",""CS"",""DA"",""NL"",""EN"",""FI"",""FR"",""DE"",""EL"",""HU"",""ID"",""IT"",""JA"",""KO"",""MS"",""NB"",""PL"",""PT"",""RU"",""ZH"",""SK"",""ES"",""SV"",""TH"",""ZH"",""TR"",""UK"",""VI""]","141725696","12.4","2011-10-19T22:39:30Z","2024-03-13T16:01:04Z","We update our app regularly to make it even better for you to easily connect to the people that matter. Update to the latest version to get all the new features and improvements. 

This release includes:
- Fixes for crashes within messaging experiences 
- Performance improvements to remove latency in some of our core experiences
- iOS 17 support 

Have a question? Tap Help in the Messenger app or visit 
[facebook.com/help/messenger-app]","449.0.0",0,"USD",true,284882218,"Meta Platforms, Inc.","https://apps.apple.com/ao/developer/meta-platforms-inc/id284882218?uo=4","http://www.facebook.com/mobile/messenger",4.16686,19825,4.16686,19825,"[""https://is1-ssl.mzstatic.com/image/thumb/PurpleSource122/v4/6b/ee/9a/6bee9a38-759e-ac2d-1d68-529fbc407c57/f62962d3-e9a2-48d0-911e-0ed6be153afd_iPhone_5.5__-_Screen_1.jpg/392x696bb.jpg"",""https://is1-ssl.mzstatic.com/image/thumb/PurpleSource112/v4/90/2a/2b/902a2b10-118b-23aa-f951-f50390fbae16/4a72edd3-6841-494d-a402-89becb7e6b99_iPhone_5.5__-_Screen_3.jpg/392x696bb.jpg"",""https://is1-ssl.mzstatic.com/image/thumb/PurpleSource122/v4/d3/30/48/d3304806-8841-6be2-df6c-5d7969c6a6af/0c06fb7b-98d6-4379-8c90-2911a2430d53_iPhone_5.5__-_Screen_4.jpg/392x696bb.jpg"",""https://is1-ssl.mzstatic.com/image/thumb/PurpleSource122/v4/31/52/5d/31525d3a-1417-7349-f855-7afa24cacd88/b903d3ca-9333-4975-95ed-101a5bb1418a_iPhone_5.5__-_Screen_5.jpg/392x696bb.jpg"",""https://is1-ssl.mzstatic.com/image/thumb/PurpleSource122/v4/0a/b4/5c/0ab45cad-f66a-d30c-95d8-c869e807a004/34aa60f1-e53f-4635-9492-bc52fb6c0712_iPhone_5.5__-_Screen_6.jpg/392x696bb.jpg"",""https://is1-ssl.mzstatic.com/image/thumb/PurpleSource122/v4/5f/93/e2/5f93e252-30db-f81c-7139-1a994e855add/dc0d77b8-853d-4031-bbfe-8051380e3d08_iPhone_5.5__-_Screen_7.jpg/392x696bb.jpg"",""https://is1-ssl.mzstatic.com/image/thumb/PurpleSource112/v4/27/c7/8f/27c78f58-5d83-3345-6da8-7b769699f2fd/1b1b97d6-9bd2-4fd3-83ee-d88901d5cfa7_iPhone_5.5__-_Screen_8.jpg/392x696bb.jpg""]","[""https://is1-ssl.mzstatic.com/image/thumb/Purple122/v4/3b/06/e1/3b06e16e-53e1-975a-20a6-5a43c17875b2/7f6fd0a2-ee06-4b01-b04a-d9fec7b1c6de_iPad_2nd_Gen-_Screen_1.jpg/552x414bb.jpg"",""https://is1-ssl.mzstatic.com/image/thumb/Purple112/v4/fa/79/3e/fa793eb9-60f4-404a-291c-3d5bff5bdaad/c937f0f4-9f1f-4b81-8186-ea5d90618f1f_iPad_2nd_Gen_-_Screen_3.jpg/552x414bb.jpg""]","[]","[""iPhone5s-iPhone5s"",""iPadAir-iPadAir"",""iPadAirCellular-iPadAirCellular"",""iPadMiniRetina-iPadMiniRetina"",""iPadMiniRetinaCellular-iPadMiniRetinaCellular"",""iPhone6-iPhone6"",""iPhone6Plus-iPhone6Plus"",""iPadAir2-iPadAir2"",""iPadAir2Cellular-iPadAir2Cellular"",""iPadMini3-iPadMini3"",""iPadMini3Cellular-iPadMini3Cellular"",""iPodTouchSixthGen-iPodTouchSixthGen"",""iPhone6s-iPhone6s"",""iPhone6sPlus-iPhone6sPlus"",""iPadMini4-iPadMini4"",""iPadMini4Cellular-iPadMini4Cellular"",""iPadPro-iPadPro"",""iPadProCellular-iPadProCellular"",""iPadPro97-iPadPro97"",""iPadPro97Cellular-iPadPro97Cellular"",""iPhoneSE-iPhoneSE"",""iPhone7-iPhone7"",""iPhone7Plus-iPhone7Plus"",""iPad611-iPad611"",""iPad612-iPad612"",""iPad71-iPad71"",""iPad72-iPad72"",""iPad73-iPad73"",""iPad74-iPad74"",""iPhone8-iPhone8"",""iPhone8Plus-iPhone8Plus"",""iPhoneX-iPhoneX"",""iPad75-iPad75"",""iPad76-iPad76"",""iPhoneXS-iPhoneXS"",""iPhoneXSMax-iPhoneXSMax"",""iPhoneXR-iPhoneXR"",""iPad812-iPad812"",""iPad834-iPad834"",""iPad856-iPad856"",""iPad878-iPad878"",""iPadMini5-iPadMini5"",""iPadMini5Cellular-iPadMini5Cellular"",""iPadAir3-iPadAir3"",""iPadAir3Cellular-iPadAir3Cellular"",""iPodTouchSeventhGen-iPodTouchSeventhGen"",""iPhone11-iPhone11"",""iPhone11Pro-iPhone11Pro"",""iPadSeventhGen-iPadSeventhGen"",""iPadSeventhGenCellular-iPadSeventhGenCellular"",""iPhone11ProMax-iPhone11ProMax"",""iPhoneSESecondGen-iPhoneSESecondGen"",""iPadProSecondGen-iPadProSecondGen"",""iPadProSecondGenCellular-iPadProSecondGenCellular"",""iPadProFourthGen-iPadProFourthGen"",""iPadProFourthGenCellular-iPadProFourthGenCellular"",""iPhone12Mini-iPhone12Mini"",""iPhone12-iPhone12"",""iPhone12Pro-iPhone12Pro"",""iPhone12ProMax-iPhone12ProMax"",""iPadAir4-iPadAir4"",""iPadAir4Cellular-iPadAir4Cellular"",""iPadEighthGen-iPadEighthGen"",""iPadEighthGenCellular-iPadEighthGenCellular"",""iPadProThirdGen-iPadProThirdGen"",""iPadProThirdGenCellular-iPadProThirdGenCellular"",""iPadProFifthGen-iPadProFifthGen"",""iPadProFifthGenCellular-iPadProFifthGenCellular"",""iPhone13Pro-iPhone13Pro"",""iPhone13ProMax-iPhone13ProMax"",""iPhone13Mini-iPhone13Mini"",""iPhone13-iPhone13"",""iPadMiniSixthGen-iPadMiniSixthGen"",""iPadMiniSixthGenCellular-iPadMiniSixthGenCellular"",""iPadNinthGen-iPadNinthGen"",""iPadNinthGenCellular-iPadNinthGenCellular"",""iPhoneSEThirdGen-iPhoneSEThirdGen"",""iPadAirFifthGen-iPadAirFifthGen"",""iPadAirFifthGenCellular-iPadAirFifthGenCellular"",""iPhone14-iPhone14"",""iPhone14Plus-iPhone14Plus"",""iPhone14Pro-iPhone14Pro"",""iPhone14ProMax-iPhone14ProMax"",""iPadTenthGen-iPadTenthGen"",""iPadTenthGenCellular-iPadTenthGenCellular"",""iPadPro11FourthGen-iPadPro11FourthGen"",""iPadPro11FourthGenCellular-iPadPro11FourthGenCellular"",""iPadProSixthGen-iPadProSixthGen"",""iPadProSixthGenCellular-iPadProSixthGenCellular"",""iPhone15-iPhone15"",""iPhone15Plus-iPhone15Plus"",""iPhone15Pro-iPhone15Pro"",""iPhone15ProMax-iPhone15ProMax""]"
284882215,"com.facebook.Facebook","Facebook","https://apps.apple.com/ao/app/facebook/id284882215?uo=4","Explore, connect and share your interests with real people. 

Whether you’re looking for a spark of inspiration with reels or want to dive deeper into something you already love with Marketplace or in groups, you can discover ideas, experiences and people that fuel your interests and help you make progress on the things that matter to you on Facebook.

Explore and expand your interests:
* Shop for affordable and uncommon stuff on Marketplace and take your hobbies to the next level
* Personalize your Feed to see more of what you like, less of what you don’t
* Watch reels for quick entertainment that sparks inspiration
* Discover creators, small businesses and communities who can help you dive deeper into the things you care about

Connect with people and communities:
* Join groups to learn tips and tricks from real people who’ve been there, done that
* Catch up with friends, family and influencers through Feed and stories

Share your world:
* Effortlessly create reels from trending templates, or let your creativity shine with a full suite of editing tools
* Customize your profile to choose how you show up and who you share your posts with
* Turn your hobby into a side hustle by becoming a creator or selling things on Marketplace
* Celebrate everyday, candid moments with stories, which disappear in 24 hours","https://is1-ssl.mzstatic.com/image/thumb/Purple211/v4/e4/f9/80/e4f980d2-d503-5742-a5e8-14e6aa3d546c/Icon-Production-0-0-1x_U007emarketing-0-7-0-85-220.png/512x512bb.jpg","[""Social Networking""]","[""6005""]","Social Networking",6005,"12+","[""AR"",""HR"",""CS"",""DA"",""NL"",""EN"",""FI"",""FR"",""DE"",""EL"",""HE"",""HI"",""HU"",""ID"",""IT"",""JA"",""KO"",""MS"",""NB"",""PL"",""PT"",""RO"",""RU"",""ZH"",""SK"",""ES"",""SV"",""TH"",""ZH"",""TR"",""UK"",""VI""]","330893312","13.4","2019-02-05T08:00:00Z","2024-03-13T18:01:06Z","We’ve updated the app to fix some crashes, make features load faster and support iOS 17!","455.0.0",0,"USD",true,284882218,"Meta Platforms, Inc.","https://apps.apple.com/ao/developer/meta-platforms-inc/id284882218?uo=4","http://www.facebook.com/mobile",4.37374,35656,4.37374,35656,"[""https://is1-ssl.mzstatic.com/image/thumb/PurpleSource126/v4/ff/a7/90/ffa79054-1f3f-35a1-6729-ef403a6081ac/c5a00a2f-7017-4b42-9f42-9b96036a8c34_iOS-5.5-Home.png/392x696bb.png"",""https://is1-ssl.mzstatic.com/image/thumb/Purple126/v4/79/d4/b6/79d4b62b-0e23-a41e-b3e7-9914d48d800d/16216c14-f578-4f89-b80d-9bc599e7e359_iOS-5.5-Reels.png/392x696bb.png"",""https://is1-ssl.mzstatic.com/image/thumb/Purple126/v4/d1/df/78/d1df7868-74d3-854d-6071-9f132a82914c/11ff572a-bf1d-463d-a475-eb7467991cb2_iOS-5.5-Stories.png/392x696bb.png"",""https://is1-ssl.mzstatic.com/image/thumb/PurpleSource116/v4/b4/70/ee/b470eeeb-28a2-df19-8480-a17a730c84b4/fa044ecd-b866-4611-99ee-1a47027ae946_iOS-5.5-Group.png/392x696bb.png"",""https://is1-ssl.mzstatic.com/image/thumb/PurpleSource116/v4/8d/af/f0/8daff05b-ef3e-9f9a-4293-f510bab08b62/943a6d5d-9dcb-434c-a6f1-45b5496fba3c_iOS-5.5-Self_Profile.png/392x696bb.png""]","[""https://is1-ssl.mzstatic.com/image/thumb/Purple116/v4/b6/bf/5d/b6bf5da7-b3b2-7263-6858-ad127f824fc4/3d69f402-0570-4aa0-b4ae-3b186d3098f3_iPad_Pro_12.9_2nd_Gen-Home.png/576x768bb.png"",""https://is1-ssl.mzstatic.com/image/thumb/Purple116/v4/f6/9c/93/f69c9390-47ff-1d75-bdad-3f599e891e7a/e3a393bd-7c74-4e48-9868-1e93adb97c24_iPad_Pro_12.9_2nd_Gen-Watch.png/576x768bb.png"",""https://is1-ssl.mzstatic.com/image/thumb/Purple116/v4/e9/0a/0d/e90a0d4d-2786-363d-db7f-72af36bb54cd/88d21855-709c-4c4e-b871-f74053b24d6f_iPad_Pro_12.9_2nd_Gen-Self_Profile.png/576x768bb.png""]","[]","[""iPhone5s-iPhone5s"",""iPadAir-iPadAir"",""iPadAirCellular-iPadAirCellular"",""iPadMiniRetina-iPadMiniRetina"",""iPadMiniRetinaCellular-iPadMiniRetinaCellular"",""iPhone6-iPhone6"",""iPhone6Plus-iPhone6Plus"",""iPadAir2-iPadAir2"",""iPadAir2Cellular-iPadAir2Cellular"",""iPadMini3-iPadMini3"",""iPadMini3Cellular-iPadMini3Cellular"",""iPodTouchSixthGen-iPodTouchSixthGen"",""iPhone6s-iPhone6s"",""iPhone6sPlus-iPhone6sPlus"",""iPadMini4-iPadMini4"",""iPadMini4Cellular-iPadMini4Cellular"",""iPadPro-iPadPro"",""iPadProCellular-iPadProCellular"",""iPadPro97-iPadPro97"",""iPadPro97Cellular-iPadPro97Cellular"",""iPhoneSE-iPhoneSE"",""iPhone7-iPhone7"",""iPhone7Plus-iPhone7Plus"",""iPad611-iPad611"",""iPad612-iPad612"",""iPad71-iPad71"",""iPad72-iPad72"",""iPad73-iPad73"",""iPad74-iPad74"",""iPhone8-iPhone8"",""iPhone8Plus-iPhone8Plus"",""iPhoneX-iPhoneX"",""iPad75-iPad75"",""iPad76-iPad76"",""iPhoneXS-iPhoneXS"",""iPhoneXSMax-iPhoneXSMax"",""iPhoneXR-iPhoneXR"",""iPad812-iPad812"",""iPad834-iPad834"",""iPad856-iPad856"",""iPad878-iPad878"",""iPadMini5-iPadMini5"",""iPadMini5Cellular-iPadMini5Cellular"",""iPadAir3-iPadAir3"",""iPadAir3Cellular-iPadAir3Cellular"",""iPodTouchSeventhGen-iPodTouchSeventhGen"",""iPhone11-iPhone11"",""iPhone11Pro-iPhone11Pro"",""iPadSeventhGen-iPadSeventhGen"",""iPadSeventhGenCellular-iPadSeventhGenCellular"",""iPhone11ProMax-iPhone11ProMax"",""iPhoneSESecondGen-iPhoneSESecondGen"",""iPadProSecondGen-iPadProSecondGen"",""iPadProSecondGenCellular-iPadProSecondGenCellular"",""iPadProFourthGen-iPadProFourthGen"",""iPadProFourthGenCellular-iPadProFourthGenCellular"",""iPhone12Mini-iPhone12Mini"",""iPhone12-iPhone12"",""iPhone12Pro-iPhone12Pro"",""iPhone12ProMax-iPhone12ProMax"",""iPadAir4-iPadAir4"",""iPadAir4Cellular-iPadAir4Cellular"",""iPadEighthGen-iPadEighthGen"",""iPadEighthGenCellular-iPadEighthGenCellular"",""iPadProThirdGen-iPadProThirdGen"",""iPadProThirdGenCellular-iPadProThirdGenCellular"",""iPadProFifthGen-iPadProFifthGen"",""iPadProFifthGenCellular-iPadProFifthGenCellular"",""iPhone13Pro-iPhone13Pro"",""iPhone13ProMax-iPhone13ProMax"",""iPhone13Mini-iPhone13Mini"",""iPhone13-iPhone13"",""iPadMiniSixthGen-iPadMiniSixthGen"",""iPadMiniSixthGenCellular-iPadMiniSixthGenCellular"",""iPadNinthGen-iPadNinthGen"",""iPadNinthGenCellular-iPadNinthGenCellular"",""iPhoneSEThirdGen-iPhoneSEThirdGen"",""iPadAirFifthGen-iPadAirFifthGen"",""iPadAirFifthGenCellular-iPadAirFifthGenCellular"",""iPhone14-iPhone14"",""iPhone14Plus-iPhone14Plus"",""iPhone14Pro-iPhone14Pro"",""iPhone14ProMax-iPhone14ProMax"",""iPadTenthGen-iPadTenthGen"",""iPadTenthGenCellular-iPadTenthGenCellular"",""iPadPro11FourthGen-iPadPro11FourthGen"",""iPadPro11FourthGenCellular-iPadPro11FourthGenCellular"",""iPadProSixthGen-iPadProSixthGen"",""iPadProSixthGenCellular-iPadProSixthGenCellular"",""iPhone15-iPhone15"",""iPhone15Plus-iPhone15Plus"",""iPhone15Pro-iPhone15Pro"",""iPhone15ProMax-iPhone15ProMax""]"
389801252,"com.burbn.instagram","Instagram","https://apps.apple.com/ao/app/instagram/id389801252?uo=4","Bringing you closer to the people and things you love – Instagram from Facebook

Connect with friends, share what you're up to or see what's new from others all over the world. Explore our community where you can feel free to be yourself and share everything from your daily moments to life's highlights.

Express yourself and connect with friends

* Add photos and videos to your story that disappear after 24 hours, and bring them to life with fun creative tools.
* Message your friends with Messenger. Share and connect over what you see on feed and Stories.
* Create and discover short, entertaining videos on Instagram with Reels.
* Post photos and videos to your feed that you want to show on your profile.

Learn more about your interests

* Watch videos from your favourite creators and discover new content through Instagram video and Reels.
* Get inspired by photos and videos from new accounts in Explore.
* Discover brands and small businesses, and shop products that are relevant to your personal style.
Some Instagram features may not be available in your country or region.

Terms of Service - https://help.instagram.com/581066165581870","https://is1-ssl.mzstatic.com/image/thumb/Purple211/v4/f4/57/82/f457827a-1c4d-f152-8673-cca8c6dce74e/Prod-0-0-1x_U007emarketing-0-7-0-85-220.png/512x512bb.jpg","[""Photo & Video"",""Social Networking""]","[""6008"",""6005""]","Photo & Video",6008,"12+","[""HR"",""CS"",""DA"",""NL"",""EN"",""FI"",""FR"",""DE"",""EL"",""HI"",""HU"",""ID"",""IT"",""JA"",""KO"",""MS"",""NB"",""PL"",""PT"",""RO"",""RU"",""ZH"",""SK"",""ES"",""SV"",""TL"",""TH"",""ZH"",""TR"",""UK"",""VI""]","268824576","15.0","2011-07-10T02:25:29Z","2024-03-13T13:49:59Z","The latest version contains bug fixes and performance improvements.","322.1.0",0,"USD",true,389801255,"Instagram, Inc.","https://apps.apple.com/ao/developer/instagram-inc/id389801255?uo=4","http://instagram.com/",4.52534,88583,4.52534,88583,"[""https://is1-ssl.mzstatic.com/image/thumb/PurpleSource126/v4/a0/61/ac/a061acd3-7ed7-35a0-13ac-a32118d207f8/d3d261bd-e303-4e80-8f54-a9bc4f2cffb0_1_iOS_5.5.jpg/392x696bb.jpg"",""https://is1-ssl.mzstatic.com/image/thumb/PurpleSource116/v4/b0/98/26/b09826c3-a337-44f7-e87c-77fa1a81513d/40a5bc7e-1a94-4758-b511-720a2e8e0584_2_iOS_5.5.jpg/392x696bb.jpg"",""https://is1-ssl.mzstatic.com/image/thumb/PurpleSource126/v4/cf/c4/26/cfc42668-92a3-21ed-2d54-95cbda1b81d2/526b8da8-e73d-4eea-bd5c-8c6fc1f09203_3_iOS_5.5.jpg/392x696bb.jpg"",""https://is1-ssl.mzstatic.com/image/thumb/PurpleSource126/v4/2f/a6/fe/2fa6feb5-ef6a-c1f0-5b85-7cdaf4a513e9/d7d9ff31-3af2-47fb-936f-586acc292c08_4_iOS_5.5.jpg/392x696bb.jpg"",""https://is1-ssl.mzstatic.com/image/thumb/PurpleSource116/v4/ca/1f/6f/ca1f6fd0-3cfc-2a51-e3bb-a6ace22f58f3/4ecc454b-ce45-4ff5-829e-c14cb5554a39_5_iOS_5.5.jpg/392x696bb.jpg"",""https://is1-ssl.mzstatic.com/image/thumb/PurpleSource116/v4/4b/45/77/4b45771f-2d03-276e-72e0-7294b1caffa9/3fc44b70-449d-463d-a8b8-10dc337a5da5_6_iOS_5.5.jpg/392x696bb.jpg""]","[]","[]","[""iPhone5s-iPhone5s"",""iPadAir-iPadAir"",""iPadAirCellular-iPadAirCellular"",""iPadMiniRetina-iPadMiniRetina"",""iPadMiniRetinaCellular-iPadMiniRetinaCellular"",""iPhone6-iPhone6"",""iPhone6Plus-iPhone6Plus"",""iPadAir2-iPadAir2"",""iPadAir2Cellular-iPadAir2Cellular"",""iPadMini3-iPadMini3"",""iPadMini3Cellular-iPadMini3Cellular"",""iPodTouchSixthGen-iPodTouchSixthGen"",""iPhone6s-iPhone6s"",""iPhone6sPlus-iPhone6sPlus"",""iPadMini4-iPadMini4"",""iPadMini4Cellular-iPadMini4Cellular"",""iPadPro-iPadPro"",""iPadProCellular-iPadProCellular"",""iPadPro97-iPadPro97"",""iPadPro97Cellular-iPadPro97Cellular"",""iPhoneSE-iPhoneSE"",""iPhone7-iPhone7"",""iPhone7Plus-iPhone7Plus"",""iPad611-iPad611"",""iPad612-iPad612"",""iPad71-iPad71"",""iPad72-iPad72"",""iPad73-iPad73"",""iPad74-iPad74"",""iPhone8-iPhone8"",""iPhone8Plus-iPhone8Plus"",""iPhoneX-iPhoneX"",""iPad75-iPad75"",""iPad76-iPad76"",""iPhoneXS-iPhoneXS"",""iPhoneXSMax-iPhoneXSMax"",""iPhoneXR-iPhoneXR"",""iPad812-iPad812"",""iPad834-iPad834"",""iPad856-iPad856"",""iPad878-iPad878"",""iPadMini5-iPadMini5"",""iPadMini5Cellular-iPadMini5Cellular"",""iPadAir3-iPadAir3"",""iPadAir3Cellular-iPadAir3Cellular"",""iPodTouchSeventhGen-iPodTouchSeventhGen"",""iPhone11-iPhone11"",""iPhone11Pro-iPhone11Pro"",""iPadSeventhGen-iPadSeventhGen"",""iPadSeventhGenCellular-iPadSeventhGenCellular"",""iPhone11ProMax-iPhone11ProMax"",""iPhoneSESecondGen-iPhoneSESecondGen"",""iPadProSecondGen-iPadProSecondGen"",""iPadProSecondGenCellular-iPadProSecondGenCellular"",""iPadProFourthGen-iPadProFourthGen"",""iPadProFourthGenCellular-iPadProFourthGenCellular"",""iPhone12Mini-iPhone12Mini"",""iPhone12-iPhone12"",""iPhone12Pro-iPhone12Pro"",""iPhone12ProMax-iPhone12ProMax"",""iPadAir4-iPadAir4"",""iPadAir4Cellular-iPadAir4Cellular"",""iPadEighthGen-iPadEighthGen"",""iPadEighthGenCellular-iPadEighthGenCellular"",""iPadProThirdGen-iPadProThirdGen"",""iPadProThirdGenCellular-iPadProThirdGenCellular"",""iPadProFifthGen-iPadProFifthGen"",""iPadProFifthGenCellular-iPadProFifthGenCellular"",""iPhone13Pro-iPhone13Pro"",""iPhone13ProMax-iPhone13ProMax"",""iPhone13Mini-iPhone13Mini"",""iPhone13-iPhone13"",""iPadMiniSixthGen-iPadMiniSixthGen"",""iPadMiniSixthGenCellular-iPadMiniSixthGenCellular"",""iPadNinthGen-iPadNinthGen"",""iPadNinthGenCellular-iPadNinthGenCellular"",""iPhoneSEThirdGen-iPhoneSEThirdGen"",""iPadAirFifthGen-iPadAirFifthGen"",""iPadAirFifthGenCellular-iPadAirFifthGenCellular"",""iPhone14-iPhone14"",""iPhone14Plus-iPhone14Plus"",""iPhone14Pro-iPhone14Pro"",""iPhone14ProMax-iPhone14ProMax"",""iPadTenthGen-iPadTenthGen"",""iPadTenthGenCellular-iPadTenthGenCellular"",""iPadPro11FourthGen-iPadPro11FourthGen"",""iPadPro11FourthGenCellular-iPadPro11FourthGenCellular"",""iPadProSixthGen-iPadProSixthGen"",""iPadProSixthGenCellular-iPadProSixthGenCellular"",""iPhone15-iPhone15"",""iPhone15Plus-iPhone15Plus"",""iPhone15Pro-iPhone15Pro"",""iPhone15ProMax-iPhone15ProMax""]"
